[
  {
    "iso3": "GBR", "iso2": "gb", "numeric": "826", "name": "United Kingdom", "region": "Europe",
    "system": "Unitary parliamentary constitutional monarchy", "systemType": "parliamentary-monarchy", "status": "stable",
    "executive": {
      "headOfState": { "name": "Charles III", "title": "King", "since": "2022" },
      "headOfGovernment": { "name": "Andy Burnham", "title": "Prime Minister", "party": "Labour", "since": "2026-07" },
      "governingParties": ["Labour"]
    },
    "legislature": [
      { "name": "House of Commons (650)", "control": "Labour majority", "detail": "Large majority from the July 2024 landslide; Reform UK leads many national polls." },
      { "name": "House of Lords", "control": "No overall control", "detail": "Appointed; hereditary peers being removed by 2025–26 legislation." }
    ],
    "judiciary": "Supreme Court of the United Kingdom; separate Scottish legal system.",
    "elections": [
      { "name": "General election", "date": "2024-07-04", "status": "held", "note": "Labour landslide under Keir Starmer." },
      { "name": "Scottish, Welsh & English local elections", "date": "2026-05-07", "status": "held", "note": "Heavy Labour losses triggered Starmer's exit." },
      { "name": "Labour leadership (Burnham elected unopposed)", "date": "2026-07-17", "status": "held" },
      { "name": "General election (latest)", "date": "2029-08", "status": "upcoming" }
    ],
    "synopsis": "Keir Starmer resigned as Labour leader after disastrous May 2026 local elections; Andy Burnham, returning to Parliament via the Makerfield by-election, became Labour leader unopposed and Prime Minister in July 2026. He is trying to reset the government's direction against a strong challenge from Reform UK.",
    "policies": ["Growth, housing and planning reform", "Public service and NHS recovery", "Closer post-Brexit relations with the EU", "Defence spending increase and support for Ukraine"],
    "challenges": ["Weak polling and rise of Reform UK", "Tight public finances", "Irregular migration (small boats)", "Union tensions after the 2026 Scottish and Welsh elections"],
    "lastVerified": "2026-10-25",
    "reviewNote": "Confirm Burnham's appointment date and cabinet."
  },
  {
    "iso3": "IRL", "iso2": "ie", "numeric": "372", "name": "Ireland", "region": "Europe",
    "system": "Unitary parliamentary republic", "systemType": "parliamentary-republic", "status": "stable",
    "executive": {
      "headOfState": { "name": "Catherine Connolly", "title": "President", "party": "Independent (left-backed)", "since": "2025-11-11" },
      "headOfGovernment": { "name": "Micheál Martin", "title": "Taoiseach", "party": "Fianna Fáil", "since": "2025-01-23" },
      "governingParties": ["Fianna Fáil", "Fine Gael", "Regional Independents"]
    },
    "legislature": [
      { "name": "Dáil Éireann (174)", "control": "FF–FG coalition with independents", "detail": "Sinn Féin is the main opposition." },
      { "name": "Seanad Éireann (60)", "control": "Government majority" }
    ],
    "judiciary": "Supreme Court of Ireland.",
    "elections": [
      { "name": "General election", "date": "2024-11-29", "status": "held" },
      { "name": "Presidential election", "date": "2025-10-24", "status": "held", "note": "Connolly won decisively." },
      { "name": "General election (latest)", "date": "2030", "status": "upcoming", "note": "Simon Harris (FG) due to rotate in as Taoiseach in Nov 2027." }
    ],
    "synopsis": "A centre-right Fianna Fáil–Fine Gael coalition governs with independent support, with a planned rotation of Taoiseach to Simon Harris in late 2027.",
    "policies": ["Housing supply expansion", "Managing large corporate-tax surpluses (sovereign funds)", "Ireland's 2026 EU Council presidency (Jul–Dec)"],
    "challenges": ["Housing crisis", "Exposure to US tariffs and pharma/tech firms", "Infrastructure bottlenecks", "Migration debate"],
    "lastVerified": "2026-10-25"
  },
  {
    "iso3": "FRA", "iso2": "fr", "numeric": "250", "name": "France", "region": "Europe",
    "system": "Unitary semi-presidential republic", "systemType": "semi-presidential", "status": "in-flux",
    "executive": {
      "headOfState": { "name": "Emmanuel Macron", "title": "President", "party": "Renaissance", "since": "2017" },
      "headOfGovernment": { "name": "Sébastien Lecornu", "title": "Prime Minister", "party": "Renaissance", "since": "2025-09 (reappointed 2025-10)" },
      "governingParties": ["Renaissance", "MoDem", "Horizons", "Les Républicains (partial)"]
    },
    "legislature": [
      { "name": "National Assembly (577)", "control": "Hung parliament", "detail": "Left alliance, Macron's centrists and the RN–allies bloc each lack a majority; governments survive via abstentions." },
      { "name": "Senate (348)", "control": "Centre-right (LR and centrists)" }
    ],
    "judiciary": "Constitutional Council, Court of Cassation and Council of State.",
    "elections": [
      { "name": "Snap legislative election", "date": "2024-07-07", "status": "held" },
      { "name": "Municipal elections", "date": "2026-03", "status": "held" },
      { "name": "Presidential election (1st round)", "date": "2027-04", "status": "upcoming", "note": "Macron is term-limited; Marine Le Pen barred pending appeal, Jordan Bardella RN's likely candidate." }
    ],
    "synopsis": "France has cycled through prime ministers since the 2024 snap election produced a hung parliament. Budget consolidation and the 2027 presidential succession dominate.",
    "policies": ["Deficit reduction through difficult budgets", "Pension reform (partially suspended as a concession)", "European defence and support for Ukraine"],
    "challenges": ["Government instability and no-confidence threats", "High deficit and debt; rating downgrades", "Rise of the National Rally"],
    "lastVerified": "2026-10-25",
    "reviewNote": "Prime minister status not verified for 2026 — confirm."
  },
  {
    "iso3": "DEU", "iso2": "de", "numeric": "276", "name": "Germany", "region": "Europe",
    "system": "Federal parliamentary republic", "systemType": "parliamentary-republic", "status": "stable",
    "executive": {
      "headOfState": { "name": "Frank-Walter Steinmeier", "title": "Federal President", "party": "SPD (non-partisan in office)", "since": "2017" },
      "headOfGovernment": { "name": "Friedrich Merz", "title": "Federal Chancellor", "party": "CDU", "since": "2025-05-06" },
      "governingParties": ["CDU/CSU", "SPD"]
    },
    "legislature": [
      { "name": "Bundestag (630)", "control": "CDU/CSU–SPD coalition (328 seats)", "detail": "AfD is the largest opposition party." },
      { "name": "Bundesrat (69)", "control": "Represents state governments; no fixed majority" }
    ],
    "judiciary": "Federal Constitutional Court (Karlsruhe) with strong judicial review.",
    "elections": [
      { "name": "Federal election", "date": "2025-02-23", "status": "held" },
      { "name": "State elections (BW, RP, ST, MV, Berlin)", "date": "2026-09-20", "status": "held", "note": "Five state elections across 2026 (March–September)." },
      { "name": "Federal Convention (presidential election)", "date": "2027-02", "status": "upcoming" },
      { "name": "Federal election", "date": "2029", "status": "upcoming" }
    ],
    "synopsis": "Merz leads a grand coalition with the SPD after loosening the debt brake for defence and infrastructure. The government is trying to revive a stagnant economy while the AfD polls strongly.",
    "policies": ["€500bn infrastructure fund and exemption of defence from the debt brake", "Tighter migration and border controls", "Military expansion and new military service model", "Economic competitiveness and bureaucracy reduction"],
    "challenges": ["Economic stagnation and industrial decline", "AfD strength, especially in the east", "Coalition friction on welfare and pensions"],
    "lastVerified": "2026-10-25"
  },
  {
    "iso3": "NLD", "iso2": "nl", "numeric": "528", "name": "Netherlands", "region": "Europe",
    "system": "Parliamentary constitutional monarchy", "systemType": "parliamentary-monarchy", "status": "stable",
    "executive": {
      "headOfState": { "name": "Willem-Alexander", "title": "King", "since": "2013" },
      "headOfGovernment": { "name": "Rob Jetten", "title": "Prime Minister", "party": "D66", "since": "2026-02-23" },
      "governingParties": ["D66", "VVD", "CDA"]
    },
    "legislature": [
      { "name": "House of Representatives (150)", "control": "Minority coalition (66 seats)", "detail": "Needs opposition support bill by bill; PVV and GL–PvdA lead the opposition." },
      { "name": "Senate (75)", "control": "No government majority" }
    ],
    "judiciary": "Supreme Court; Dutch courts cannot review laws for constitutionality.",
    "elections": [
      { "name": "General election", "date": "2025-10-29", "status": "held", "note": "D66 narrowly edged out the PVV." },
      { "name": "Municipal elections", "date": "2026-03-18", "status": "held" },
      { "name": "Provincial / Senate elections", "date": "2027-03", "status": "upcoming" }
    ],
    "synopsis": "Rob Jetten, the youngest PM in Dutch history, leads a centrist minority cabinet that must negotiate every bill. Planned health and welfare savings face strong opposition.",
    "policies": ["Housing construction push", "Health and welfare cost containment", "Stricter but managed migration policy", "Climate and nitrogen policy"],
    "challenges": ["Governing as a minority", "Housing shortage", "Nitrogen permit gridlock"],
    "lastVerified": "2026-10-25"
  },
  {
    "iso3": "BEL", "iso2": "be", "numeric": "056", "name": "Belgium", "region": "Europe",
    "system": "Federal parliamentary constitutional monarchy", "systemType": "parliamentary-monarchy", "status": "stable",
    "executive": {
      "headOfState": { "name": "Philippe", "title": "King", "since": "2013" },